{
  "$schema": "http://json-schema.org/draft-07/schema#",
  "$id": "https://github.com/atikulislamshadin96/crypto-research-signal-system/blob/main/strategy_discovery_v1/second_collection_v1/schemas/engine_fidelity_recovery_package_v1_1_round_a.schema.json",
  "title": "Finite recovery package v1.1 Round A amendment",
  "type": "object",
  "additionalProperties": false,
  "required": ["package_id", "version", "status", "amendment_scope", "parent_package", "candidate_registry", "round_a_candidates", "excluded_candidates", "inherited_policy", "authorization_boundary", "current_state", "package_canonical_sha256"],
  "properties": {
    "package_id": {"const": "strategy_discovery_v1_recovery_package_v1_1_round_a"},
    "version": {"const": "1.1.0"},
    "status": {"const": "frozen_pre_measurement"},
    "amendment_scope": {"const": "Add exact Round A candidate identities and source snapshot hashes only; all parent finite-budget, CPCV, holdout, cost and survivor rules remain unchanged."},
    "parent_package": {"type": "object", "additionalProperties": false, "required": ["path", "canonical_sha256", "file_sha256", "starting_commit"], "properties": {"path": {"const": "strategy_discovery_v1/second_collection_v1/data/engine_fidelity_recovery_package_v1.json"}, "canonical_sha256": {"const": "fcf677c23199e3e9d4b024bc9ff4a09f0603ede6bc3326ca0815f9bd58119adc"}, "file_sha256": {"const": "57a7269117bbeb41e89986e2ac90725a5ed56e710912e88d0443717bb8f9e16c"}, "starting_commit": {"const": "5225f00b01fc37228c4326bd36bf0ed1b5f3a15a"}}},
    "candidate_registry": {"type": "object", "additionalProperties": false, "required": ["path", "file_sha256", "source_repository", "source_commit", "license", "ordering_rule", "eligible_count", "excluded_count"], "properties": {"path": {"const": "strategy_discovery_v1/second_collection_v1/data/quantconnect_lean_round_a_candidate_registry_v1.json"}, "file_sha256": {"pattern": "^[0-9a-f]{64}$"}, "source_repository": {"const": "QuantConnect/Lean"}, "source_commit": {"const": "07fb0182bfe229edd9445cf675ac6509d0069539"}, "license": {"const": "Apache-2.0"}, "ordering_rule": {"type": "string", "minLength": 40}, "eligible_count": {"const": 6}, "excluded_count": {"const": 1}}},
    "round_a_candidates": {"type": "array", "minItems": 6, "maxItems": 6, "items": {"type": "object", "additionalProperties": false, "required": ["rank", "candidate_id", "repository_path", "file_sha256", "class_name", "source_default_resolution", "adapter_main_timeframe", "adapter_detail_timeframe", "adapter_parameters", "parameter_policy", "source_rule_status", "measurement_status"], "properties": {"rank": {"type": "integer", "minimum": 1, "maximum": 6}, "candidate_id": {"type": "string", "pattern": "^quantconnect-lean-round-a-[0-9]{3}-[a-z0-9-]+$"}, "repository_path": {"type": "string", "pattern": "^Algorithm\\.Framework/Alphas/.+\\.py$"}, "file_sha256": {"type": "string", "pattern": "^[0-9a-f]{64}$"}, "class_name": {"type": "string", "minLength": 5}, "source_default_resolution": {"type": "string", "minLength": 4}, "adapter_main_timeframe": {"const": "1d"}, "adapter_detail_timeframe": {"const": "15m"}, "adapter_parameters": {"type": "object"}, "parameter_policy": {"type": "string", "minLength": 30}, "source_rule_status": {"type": "string", "minLength": 20}, "measurement_status": {"const": "not_authorized"}}}},
    "excluded_candidates": {"type": "array", "minItems": 1, "maxItems": 1, "items": {"type": "object", "additionalProperties": false, "required": ["repository_path", "file_sha256", "class_name", "source_default_resolution", "reason"], "properties": {"repository_path": {"const": "Algorithm.Framework/Alphas/PearsonCorrelationPairsTradingAlphaModel.py"}, "file_sha256": {"const": "9cb269d82d8cbd7bd44ccc98c7168a17b9bc2603f2fffa1a8814a2916b2b890e"}, "class_name": {"const": "PearsonCorrelationPairsTradingAlphaModel"}, "source_default_resolution": {"const": "Resolution.MINUTE"}, "reason": {"type": "string", "minLength": 40}}}},
    "inherited_policy": {"type": "object", "additionalProperties": false, "required": ["candidate_budget", "cpcv", "holdout", "execution_cost_gate", "survivor_gates", "trial_accounting", "policy_unchanged"], "properties": {"candidate_budget": {"const": {"existing_v2_4_failed_candidate_families": 6, "additional_valid_candidate_families_max": 18, "round_count": 3, "candidates_per_round_max": 6, "hard_cancel_if_additional_valid_failures": 18, "attempted_leads_max": 30, "cancel_if_valid_measurable_candidates_below": 18, "total_measured_family_budget": 24}}, "cpcv": {"const": {"protocol_id": "dsr_pbo_cpcv_v2_12x2", "n_groups": 12, "test_groups_per_split": 2, "split_count": 66, "path_count": 11, "group_assignment": "12 contiguous chronological development-window groups; no random shuffling", "purge_days": 30, "embargo_days": 30, "minimum_training_observations": 60, "zero_training_split_policy": "fail_closed; any split below minimum invalidates the package", "fit_isolation": "fit transforms and selection logic on training data only"}}, "holdout": {"const": {"start_utc": "2026-06-23T00:00:00Z", "end_exclusive_utc": "2026-08-22T00:00:00Z", "development_end_utc": "2026-06-23T00:00:00Z", "minimum_observations": 60, "selection_uses_holdout": false, "tuning_uses_holdout": false, "positive_after_cost_required": true, "holdout_failure_policy": "candidate fails; no post-hoc repair using holdout"}}, "execution_cost_gate": {"const": {"engine": "Freqtrade pinned engine eb1a668ceb0f29b7d578156bfc24c45278c0c0f8", "native_fee_control": "--fee", "base_fee_per_side": 0.00055, "fee_sensitivity_ladder_per_side": [0.00055, 0.00075, 0.001], "slippage_value": 0.0, "global_adverse_slippage_control_available": false, "price_modification_allowed": false, "return_postprocessing_allowed": false, "engine_patch_allowed": false, "survivor_rule": "A survivor must pass the base native fee and every pre-declared fee sensitivity variant; no fee variant may be chosen after seeing results.", "limitation": "Pinned Freqtrade has no global fixed adverse-slippage control; slippage=0.0 is a measurement limitation and is not a claim of frictionless real execution."}}, "survivor_gates": {"type": "array", "minItems": 8, "maxItems": 8}, "trial_accounting": {"type": "object"}, "policy_unchanged": {"const": true}}},
    "authorization_boundary": {"type": "object", "additionalProperties": false, "required": ["candidate_registry_creation_authorized", "measurement_authorized", "backtest_authorized", "data_acquisition_authorized", "trial_creation_authorized", "ledger_append_authorized", "statistics_authorized", "promotion_authorized", "trading_authorized", "deployment_authorized"], "properties": {"candidate_registry_creation_authorized": {"const": true}, "measurement_authorized": {"const": false}, "backtest_authorized": {"const": false}, "data_acquisition_authorized": {"const": false}, "trial_creation_authorized": {"const": false}, "ledger_append_authorized": {"const": false}, "statistics_authorized": {"const": false}, "promotion_authorized": {"const": false}, "trading_authorized": {"const": false}, "deployment_authorized": {"const": false}}},
    "current_state": {"type": "object", "additionalProperties": false, "required": ["measurement_ready", "measurement_authorized", "trial_ids_created", "ledger_changed", "statistics_run", "promotion_allowed", "trading_allowed", "deployment_allowed"], "properties": {"measurement_ready": {"const": false}, "measurement_authorized": {"const": false}, "trial_ids_created": {"const": false}, "ledger_changed": {"const": false}, "statistics_run": {"const": false}, "promotion_allowed": {"const": false}, "trading_allowed": {"const": false}, "deployment_allowed": {"const": false}}},
    "package_canonical_sha256": {"type": "string", "pattern": "^[0-9a-f]{64}$"}
  }
}
